{
  "cssVars": {
    "light": {
      "primary-color": "#059669",
      "primary-foreground-color": "#f0fdf4",
      "secondary-color": "#bbf7d0",
      "secondary-foreground-color": "#14532d",
      "background-color": "#ffffff",
      "foreground-color": "#14532d",
      "card-color": "#ffffff",
      "card-foreground-color": "#14532d",
      "popover-color": "#ffffff",
      "popover-foreground-color": "#14532d",
      "muted-color": "#bbf7d0",
      "muted-foreground-color": "#16a34a",
      "accent-color": "#bbf7d0",
      "accent-foreground-color": "#14532d",
      "destructive-color": "#ef4444",
      "destructive-foreground-color": "#f0fdf4",
      "border-color": "#86efac",
      "input-color": "#86efac",
      "ring-color": "#14532d"
    },
    "dark": {
      "primary-color": "#4ade80",
      "primary-foreground-color": "#14532d",
      "secondary-color": "#14532d",
      "secondary-foreground-color": "#f0fdf4",
      "background-color": "#052e16",
      "foreground-color": "#f0fdf4",
      "card-color": "#052e16",
      "card-foreground-color": "#f0fdf4",
      "popover-color": "#052e16",
      "popover-foreground-color": "#f0fdf4",
      "muted-color": "#14532d",
      "muted-foreground-color": "#4ade80",
      "accent-color": "#14532d",
      "accent-foreground-color": "#f0fdf4",
      "destructive-color": "#dc2626",
      "destructive-foreground-color": "#f0fdf4",
      "border-color": "#14532d",
      "input-color": "#14532d",
      "ring-color": "#86efac"
    }
  },
  "cssVarsTemplate": ":root {\n  --primary-color: #059669;\n  --primary-foreground-color: #f0fdf4;\n  --secondary-color: #bbf7d0;\n  --secondary-foreground-color: #14532d;\n  --background-color: #ffffff;\n  --foreground-color: #14532d;\n  --card-color: #ffffff;\n  --card-foreground-color: #14532d;\n  --popover-color: #ffffff;\n  --popover-foreground-color: #14532d;\n  --muted-color: #bbf7d0;\n  --muted-foreground-color: #16a34a;\n  --accent-color: #bbf7d0;\n  --accent-foreground-color: #14532d;\n  --destructive-color: #ef4444;\n  --destructive-foreground-color: #f0fdf4;\n  --border-color: #86efac;\n  --input-color: #86efac;\n  --ring-color: #14532d;\n}\n\n[data-mode=\"dark\"] {\n  --primary-color: #4ade80;\n  --primary-foreground-color: #14532d;\n  --secondary-color: #14532d;\n  --secondary-foreground-color: #f0fdf4;\n  --background-color: #052e16;\n  --foreground-color: #f0fdf4;\n  --card-color: #052e16;\n  --card-foreground-color: #f0fdf4;\n  --popover-color: #052e16;\n  --popover-foreground-color: #f0fdf4;\n  --muted-color: #14532d;\n  --muted-foreground-color: #4ade80;\n  --accent-color: #14532d;\n  --accent-foreground-color: #f0fdf4;\n  --destructive-color: #dc2626;\n  --destructive-foreground-color: #f0fdf4;\n  --border-color: #14532d;\n  --input-color: #14532d;\n  --ring-color: #86efac;\n}"
}