{
  "cssVars": {
    "light": {
      "primary-color": "#111827",
      "primary-foreground-color": "#f9fafb",
      "secondary-color": "#f3f4f6",
      "secondary-foreground-color": "#111827",
      "background-color": "#ffffff",
      "foreground-color": "#111827",
      "card-color": "#ffffff",
      "card-foreground-color": "#111827",
      "popover-color": "#ffffff",
      "popover-foreground-color": "#111827",
      "muted-color": "#f3f4f6",
      "muted-foreground-color": "#6b7280",
      "accent-color": "#f3f4f6",
      "accent-foreground-color": "#111827",
      "destructive-color": "#ef4444",
      "destructive-foreground-color": "#f9fafb",
      "border-color": "#e5e7eb",
      "input-color": "#e5e7eb",
      "ring-color": "#111827"
    },
    "dark": {
      "primary-color": "#f9fafb",
      "primary-foreground-color": "#111827",
      "secondary-color": "#1f2937",
      "secondary-foreground-color": "#f9fafb",
      "background-color": "#030712",
      "foreground-color": "#f9fafb",
      "card-color": "#030712",
      "card-foreground-color": "#f9fafb",
      "popover-color": "#030712",
      "popover-foreground-color": "#f9fafb",
      "muted-color": "#1f2937",
      "muted-foreground-color": "#9ca3af",
      "accent-color": "#1f2937",
      "accent-foreground-color": "#f9fafb",
      "destructive-color": "#dc2626",
      "destructive-foreground-color": "#f9fafb",
      "border-color": "#1f2937",
      "input-color": "#1f2937",
      "ring-color": "#d1d5db"
    }
  },
  "cssVarsTemplate": ":root {\n  --primary-color: #111827;\n  --primary-foreground-color: #f9fafb;\n  --secondary-color: #f3f4f6;\n  --secondary-foreground-color: #111827;\n  --background-color: #ffffff;\n  --foreground-color: #111827;\n  --card-color: #ffffff;\n  --card-foreground-color: #111827;\n  --popover-color: #ffffff;\n  --popover-foreground-color: #111827;\n  --muted-color: #f3f4f6;\n  --muted-foreground-color: #6b7280;\n  --accent-color: #f3f4f6;\n  --accent-foreground-color: #111827;\n  --destructive-color: #ef4444;\n  --destructive-foreground-color: #f9fafb;\n  --border-color: #e5e7eb;\n  --input-color: #e5e7eb;\n  --ring-color: #111827;\n}\n\n[data-mode=\"dark\"] {\n  --primary-color: #f9fafb;\n  --primary-foreground-color: #111827;\n  --secondary-color: #1f2937;\n  --secondary-foreground-color: #f9fafb;\n  --background-color: #030712;\n  --foreground-color: #f9fafb;\n  --card-color: #030712;\n  --card-foreground-color: #f9fafb;\n  --popover-color: #030712;\n  --popover-foreground-color: #f9fafb;\n  --muted-color: #1f2937;\n  --muted-foreground-color: #9ca3af;\n  --accent-color: #1f2937;\n  --accent-foreground-color: #f9fafb;\n  --destructive-color: #dc2626;\n  --destructive-foreground-color: #f9fafb;\n  --border-color: #1f2937;\n  --input-color: #1f2937;\n  --ring-color: #d1d5db;\n}"
}