{
  "cssVars": {
    "light": {
      "primary-color": "#1d4ed8",
      "primary-foreground-color": "#eff6ff",
      "secondary-color": "#dbeafe",
      "secondary-foreground-color": "#1e3a8a",
      "background-color": "#ffffff",
      "foreground-color": "#1e3a8a",
      "card-color": "#ffffff",
      "card-foreground-color": "#1e3a8a",
      "popover-color": "#ffffff",
      "popover-foreground-color": "#1e3a8a",
      "muted-color": "#dbeafe",
      "muted-foreground-color": "#3b82f6",
      "accent-color": "#dbeafe",
      "accent-foreground-color": "#1e3a8a",
      "destructive-color": "#ef4444",
      "destructive-foreground-color": "#eff6ff",
      "border-color": "#bfdbfe",
      "input-color": "#bfdbfe",
      "ring-color": "#1e3a8a"
    },
    "dark": {
      "primary-color": "#60a5fa",
      "primary-foreground-color": "#1e3a8a",
      "secondary-color": "#1e3a8a",
      "secondary-foreground-color": "#eff6ff",
      "background-color": "#172554",
      "foreground-color": "#eff6ff",
      "card-color": "#172554",
      "card-foreground-color": "#eff6ff",
      "popover-color": "#172554",
      "popover-foreground-color": "#eff6ff",
      "muted-color": "#1e3a8a",
      "muted-foreground-color": "#60a5fa",
      "accent-color": "#1e3a8a",
      "accent-foreground-color": "#eff6ff",
      "destructive-color": "#dc2626",
      "destructive-foreground-color": "#eff6ff",
      "border-color": "#1e3a8a",
      "input-color": "#1e3a8a",
      "ring-color": "#93c5fd"
    }
  },
  "cssVarsTemplate": ":root {\n  --primary-color: #1d4ed8;\n  --primary-foreground-color: #eff6ff;\n  --secondary-color: #dbeafe;\n  --secondary-foreground-color: #1e3a8a;\n  --background-color: #ffffff;\n  --foreground-color: #1e3a8a;\n  --card-color: #ffffff;\n  --card-foreground-color: #1e3a8a;\n  --popover-color: #ffffff;\n  --popover-foreground-color: #1e3a8a;\n  --muted-color: #dbeafe;\n  --muted-foreground-color: #3b82f6;\n  --accent-color: #dbeafe;\n  --accent-foreground-color: #1e3a8a;\n  --destructive-color: #ef4444;\n  --destructive-foreground-color: #eff6ff;\n  --border-color: #bfdbfe;\n  --input-color: #bfdbfe;\n  --ring-color: #1e3a8a;\n}\n\n[data-mode=\"dark\"] {\n  --primary-color: #60a5fa;\n  --primary-foreground-color: #1e3a8a;\n  --secondary-color: #1e3a8a;\n  --secondary-foreground-color: #eff6ff;\n  --background-color: #172554;\n  --foreground-color: #eff6ff;\n  --card-color: #172554;\n  --card-foreground-color: #eff6ff;\n  --popover-color: #172554;\n  --popover-foreground-color: #eff6ff;\n  --muted-color: #1e3a8a;\n  --muted-foreground-color: #60a5fa;\n  --accent-color: #1e3a8a;\n  --accent-foreground-color: #eff6ff;\n  --destructive-color: #dc2626;\n  --destructive-foreground-color: #eff6ff;\n  --border-color: #1e3a8a;\n  --input-color: #1e3a8a;\n  --ring-color: #93c5fd;\n}"
}