{
  "cssVars": {
    "light": {
      "primary-color": "#171717",
      "primary-foreground-color": "#fafafa",
      "secondary-color": "#f5f5f5",
      "secondary-foreground-color": "#171717",
      "background-color": "#ffffff",
      "foreground-color": "#171717",
      "card-color": "#ffffff",
      "card-foreground-color": "#171717",
      "popover-color": "#ffffff",
      "popover-foreground-color": "#171717",
      "muted-color": "#f5f5f5",
      "muted-foreground-color": "#737373",
      "accent-color": "#f5f5f5",
      "accent-foreground-color": "#171717",
      "destructive-color": "#ef4444",
      "destructive-foreground-color": "#fafafa",
      "border-color": "#e5e5e5",
      "input-color": "#e5e5e5",
      "ring-color": "#171717"
    },
    "dark": {
      "primary-color": "#fafafa",
      "primary-foreground-color": "#171717",
      "secondary-color": "#262626",
      "secondary-foreground-color": "#fafafa",
      "background-color": "#0a0a0a",
      "foreground-color": "#fafafa",
      "card-color": "#0a0a0a",
      "card-foreground-color": "#fafafa",
      "popover-color": "#0a0a0a",
      "popover-foreground-color": "#fafafa",
      "muted-color": "#262626",
      "muted-foreground-color": "#a3a3a3",
      "accent-color": "#262626",
      "accent-foreground-color": "#fafafa",
      "destructive-color": "#dc2626",
      "destructive-foreground-color": "#fafafa",
      "border-color": "#262626",
      "input-color": "#262626",
      "ring-color": "#d4d4d4"
    }
  },
  "cssVarsTemplate": ":root {\n  --primary-color: #171717;\n  --primary-foreground-color: #fafafa;\n  --secondary-color: #f5f5f5;\n  --secondary-foreground-color: #171717;\n  --background-color: #ffffff;\n  --foreground-color: #171717;\n  --card-color: #ffffff;\n  --card-foreground-color: #171717;\n  --popover-color: #ffffff;\n  --popover-foreground-color: #171717;\n  --muted-color: #f5f5f5;\n  --muted-foreground-color: #737373;\n  --accent-color: #f5f5f5;\n  --accent-foreground-color: #171717;\n  --destructive-color: #ef4444;\n  --destructive-foreground-color: #fafafa;\n  --border-color: #e5e5e5;\n  --input-color: #e5e5e5;\n  --ring-color: #171717;\n}\n\n[data-mode=\"dark\"] {\n  --primary-color: #fafafa;\n  --primary-foreground-color: #171717;\n  --secondary-color: #262626;\n  --secondary-foreground-color: #fafafa;\n  --background-color: #0a0a0a;\n  --foreground-color: #fafafa;\n  --card-color: #0a0a0a;\n  --card-foreground-color: #fafafa;\n  --popover-color: #0a0a0a;\n  --popover-foreground-color: #fafafa;\n  --muted-color: #262626;\n  --muted-foreground-color: #a3a3a3;\n  --accent-color: #262626;\n  --accent-foreground-color: #fafafa;\n  --destructive-color: #dc2626;\n  --destructive-foreground-color: #fafafa;\n  --border-color: #262626;\n  --input-color: #262626;\n  --ring-color: #d4d4d4;\n}"
}