{
  "cssVars": {
    "light": {
      "primary-color": "#0f766e",
      "primary-foreground-color": "#f0fdfa",
      "secondary-color": "#ccfbf1",
      "secondary-foreground-color": "#134e4a",
      "background-color": "#ffffff",
      "foreground-color": "#134e4a",
      "card-color": "#ffffff",
      "card-foreground-color": "#134e4a",
      "popover-color": "#ffffff",
      "popover-foreground-color": "#134e4a",
      "muted-color": "#ccfbf1",
      "muted-foreground-color": "#14b8a6",
      "accent-color": "#ccfbf1",
      "accent-foreground-color": "#134e4a",
      "destructive-color": "#ef4444",
      "destructive-foreground-color": "#f0fdfa",
      "border-color": "#99f6e4",
      "input-color": "#99f6e4",
      "ring-color": "#134e4a"
    },
    "dark": {
      "primary-color": "#5eead4",
      "primary-foreground-color": "#134e4a",
      "secondary-color": "#134e4a",
      "secondary-foreground-color": "#f0fdfa",
      "background-color": "#042f2e",
      "foreground-color": "#f0fdfa",
      "card-color": "#042f2e",
      "card-foreground-color": "#f0fdfa",
      "popover-color": "#042f2e",
      "popover-foreground-color": "#f0fdfa",
      "muted-color": "#134e4a",
      "muted-foreground-color": "#5eead4",
      "accent-color": "#134e4a",
      "accent-foreground-color": "#f0fdfa",
      "destructive-color": "#dc2626",
      "destructive-foreground-color": "#f0fdfa",
      "border-color": "#134e4a",
      "input-color": "#134e4a",
      "ring-color": "#7dd3fc"
    }
  },
  "cssVarsTemplate": ":root {\n  --primary-color: #0f766e;\n  --primary-foreground-color: #f0fdfa;\n  --secondary-color: #ccfbf1;\n  --secondary-foreground-color: #134e4a;\n  --background-color: #ffffff;\n  --foreground-color: #134e4a;\n  --card-color: #ffffff;\n  --card-foreground-color: #134e4a;\n  --popover-color: #ffffff;\n  --popover-foreground-color: #134e4a;\n  --muted-color: #ccfbf1;\n  --muted-foreground-color: #14b8a6;\n  --accent-color: #ccfbf1;\n  --accent-foreground-color: #134e4a;\n  --destructive-color: #ef4444;\n  --destructive-foreground-color: #f0fdfa;\n  --border-color: #99f6e4;\n  --input-color: #99f6e4;\n  --ring-color: #134e4a;\n}\n\n[data-mode=\"dark\"] {\n  --primary-color: #5eead4;\n  --primary-foreground-color: #134e4a;\n  --secondary-color: #134e4a;\n  --secondary-foreground-color: #f0fdfa;\n  --background-color: #042f2e;\n  --foreground-color: #f0fdfa;\n  --card-color: #042f2e;\n  --card-foreground-color: #f0fdfa;\n  --popover-color: #042f2e;\n  --popover-foreground-color: #f0fdfa;\n  --muted-color: #134e4a;\n  --muted-foreground-color: #5eead4;\n  --accent-color: #134e4a;\n  --accent-foreground-color: #f0fdfa;\n  --destructive-color: #dc2626;\n  --destructive-foreground-color: #f0fdfa;\n  --border-color: #134e4a;\n  --input-color: #134e4a;\n  --ring-color: #7dd3fc;\n}"
}