{
  "cssVars": {
    "light": {
      "primary-color": "#ea580c",
      "primary-foreground-color": "#fff7ed",
      "secondary-color": "#fed7aa",
      "secondary-foreground-color": "#9a3412",
      "background-color": "#ffffff",
      "foreground-color": "#9a3412",
      "card-color": "#ffffff",
      "card-foreground-color": "#9a3412",
      "popover-color": "#ffffff",
      "popover-foreground-color": "#9a3412",
      "muted-color": "#fed7aa",
      "muted-foreground-color": "#f97316",
      "accent-color": "#fed7aa",
      "accent-foreground-color": "#9a3412",
      "destructive-color": "#ef4444",
      "destructive-foreground-color": "#fff7ed",
      "border-color": "#fdba74",
      "input-color": "#fdba74",
      "ring-color": "#9a3412"
    },
    "dark": {
      "primary-color": "#fb923c",
      "primary-foreground-color": "#9a3412",
      "secondary-color": "#9a3412",
      "secondary-foreground-color": "#fff7ed",
      "background-color": "#431407",
      "foreground-color": "#fff7ed",
      "card-color": "#431407",
      "card-foreground-color": "#fff7ed",
      "popover-color": "#431407",
      "popover-foreground-color": "#fff7ed",
      "muted-color": "#9a3412",
      "muted-foreground-color": "#fb923c",
      "accent-color": "#9a3412",
      "accent-foreground-color": "#fff7ed",
      "destructive-color": "#dc2626",
      "destructive-foreground-color": "#fff7ed",
      "border-color": "#9a3412",
      "input-color": "#9a3412",
      "ring-color": "#fdba74"
    }
  },
  "cssVarsTemplate": ":root {\n  --primary-color: #ea580c;\n  --primary-foreground-color: #fff7ed;\n  --secondary-color: #fed7aa;\n  --secondary-foreground-color: #9a3412;\n  --background-color: #ffffff;\n  --foreground-color: #9a3412;\n  --card-color: #ffffff;\n  --card-foreground-color: #9a3412;\n  --popover-color: #ffffff;\n  --popover-foreground-color: #9a3412;\n  --muted-color: #fed7aa;\n  --muted-foreground-color: #f97316;\n  --accent-color: #fed7aa;\n  --accent-foreground-color: #9a3412;\n  --destructive-color: #ef4444;\n  --destructive-foreground-color: #fff7ed;\n  --border-color: #fdba74;\n  --input-color: #fdba74;\n  --ring-color: #9a3412;\n}\n\n[data-mode=\"dark\"] {\n  --primary-color: #fb923c;\n  --primary-foreground-color: #9a3412;\n  --secondary-color: #9a3412;\n  --secondary-foreground-color: #fff7ed;\n  --background-color: #431407;\n  --foreground-color: #fff7ed;\n  --card-color: #431407;\n  --card-foreground-color: #fff7ed;\n  --popover-color: #431407;\n  --popover-foreground-color: #fff7ed;\n  --muted-color: #9a3412;\n  --muted-foreground-color: #fb923c;\n  --accent-color: #9a3412;\n  --accent-foreground-color: #fff7ed;\n  --destructive-color: #dc2626;\n  --destructive-foreground-color: #fff7ed;\n  --border-color: #9a3412;\n  --input-color: #9a3412;\n  --ring-color: #fdba74;\n}"
}