{
  "cssVars": {
    "light": {
      "primary-color": "#18181b",
      "primary-foreground-color": "#fafafa",
      "secondary-color": "#f4f4f5",
      "secondary-foreground-color": "#18181b",
      "background-color": "#ffffff",
      "foreground-color": "#18181b",
      "card-color": "#ffffff",
      "card-foreground-color": "#18181b",
      "popover-color": "#ffffff",
      "popover-foreground-color": "#18181b",
      "muted-color": "#f4f4f5",
      "muted-foreground-color": "#71717a",
      "accent-color": "#f4f4f5",
      "accent-foreground-color": "#18181b",
      "destructive-color": "#ef4444",
      "destructive-foreground-color": "#fafafa",
      "border-color": "#e4e4e7",
      "input-color": "#e4e4e7",
      "ring-color": "#18181b"
    },
    "dark": {
      "primary-color": "#fafafa",
      "primary-foreground-color": "#18181b",
      "secondary-color": "#27272a",
      "secondary-foreground-color": "#fafafa",
      "background-color": "#09090b",
      "foreground-color": "#fafafa",
      "card-color": "#09090b",
      "card-foreground-color": "#fafafa",
      "popover-color": "#09090b",
      "popover-foreground-color": "#fafafa",
      "muted-color": "#27272a",
      "muted-foreground-color": "#a1a1aa",
      "accent-color": "#27272a",
      "accent-foreground-color": "#fafafa",
      "destructive-color": "#dc2626",
      "destructive-foreground-color": "#fafafa",
      "border-color": "#27272a",
      "input-color": "#27272a",
      "ring-color": "#d4d4d8"
    }
  },
  "cssVarsTemplate": ":root {\n  --primary-color: #18181b;\n  --primary-foreground-color: #fafafa;\n  --secondary-color: #f4f4f5;\n  --secondary-foreground-color: #18181b;\n  --background-color: #ffffff;\n  --foreground-color: #18181b;\n  --card-color: #ffffff;\n  --card-foreground-color: #18181b;\n  --popover-color: #ffffff;\n  --popover-foreground-color: #18181b;\n  --muted-color: #f4f4f5;\n  --muted-foreground-color: #71717a;\n  --accent-color: #f4f4f5;\n  --accent-foreground-color: #18181b;\n  --destructive-color: #ef4444;\n  --destructive-foreground-color: #fafafa;\n  --border-color: #e4e4e7;\n  --input-color: #e4e4e7;\n  --ring-color: #18181b;\n}\n\n[data-mode=\"dark\"] {\n  --primary-color: #fafafa;\n  --primary-foreground-color: #18181b;\n  --secondary-color: #27272a;\n  --secondary-foreground-color: #fafafa;\n  --background-color: #09090b;\n  --foreground-color: #fafafa;\n  --card-color: #09090b;\n  --card-foreground-color: #fafafa;\n  --popover-color: #09090b;\n  --popover-foreground-color: #fafafa;\n  --muted-color: #27272a;\n  --muted-foreground-color: #a1a1aa;\n  --accent-color: #27272a;\n  --accent-foreground-color: #fafafa;\n  --destructive-color: #dc2626;\n  --destructive-foreground-color: #fafafa;\n  --border-color: #27272a;\n  --input-color: #27272a;\n  --ring-color: #d4d4d8;\n}"
}